text,category,location_label,location_mention,source,severity,sentiment
Report: Water pipeline leakage near Lehripura Gate. Very dangerous situation.,water,Mandvi,Lehripura Gate,Social Media,High,Negative
"Car collision at Fatehgunj, ambulance needed.",accident,Fatehgunj,Fatehgunj,News Headline,High,Negative
Accident ho gaya hai Akota Bridge me.,accident,Akota,Akota Bridge,News Headline,High,Negative
Help needed: Blinkering street lights at Sardar Estate crossroad. #Vadodara #VMC,electricity,Ajwa Road,Sardar Estate,Social Media,Medium,Negative
Alert: Wrong side driving is rampant in Railway Station.,traffic,Sayajigunj,Railway Station,WhatsApp,Medium,Negative
Report: Water is not draining in Sama.,flooding,Sama,Sama,WhatsApp,High,Negative
Alert: Bike slipped due to oil spill near Bahucharaji Road. Calling municipal corporation.,accident,Karelibaug,Bahucharaji Road,Social Media,High,Negative
Heavy rain predicted for Sursagar Lake this evening. VMC please help.,weather,Nyay Mandir,Sursagar Lake,WhatsApp,Low,Neutral
Action required: Bohat garmi hai MS University Hostel me aaj. Calling municipal corporation.,weather,Fatehgunj,MS University Hostel,WhatsApp,Low,Neutral
Action required: Heavy rain predicted for Jubilee Baug this evening. Calling municipal corporation.,weather,Raopura,Jubilee Baug,WhatsApp,Low,Neutral
Complaint: Bus hit a divider in Harni Warasia Ring Road. Please resolve asap.,accident,Harni,Harni Warasia Ring Road,WhatsApp,High,Negative
Dead animal near ITI Gorwa needs removal.,garbage,Gorwa,ITI Gorwa,Official App,High,Negative
Please check: It's extremely hot in Sama Pond today. It's been a week.,weather,Sama,Sama Pond,Social Media,Low,Neutral
Help needed: Frequent power cuts in Bright School Vasna since yesterday. Please resolve asap.,electricity,Vasna Road,Bright School Vasna,WhatsApp,Medium,Negative
Drinking water smells bad in ONGC Main Gate.,water,Tarsali,ONGC Main Gate,Official App,Medium,Negative
Report: Foul smell coming from garbage dump in Susen Circle. It is very annoying.,garbage,Tarsali,Susen Circle,WhatsApp,Medium,Negative
Illegal encroachment on footpath in Vrindavan Char Rasta.,other,Waghodia Road,Vrindavan Char Rasta,Official App,Medium,Negative
Please check: Ganda paani aa raha hai Harni me.,water,Harni,Harni,Social Media,Medium,Negative
Vishwamitri river water entering RC Dutt Road low lying areas. #Vadodara #VMC,flooding,Alkapuri,RC Dutt Road,WhatsApp,High,Negative
Bus hit a divider in Vasna Road.,accident,Vasna Road,Vasna Road,News Headline,High,Negative
Please check: Cleaning not done in Harni society. Calling municipal corporation.,garbage,Harni,Harni,Social Media,Medium,Negative
Report: Accident prone zone near Parivar Char Rasta school needs speed breaker. Authorities please take note.,accident,Waghodia Road,Parivar Char Rasta,WhatsApp,High,Negative
Bohat garmi hai Madhuban Circle me aaj.,weather,Gorwa,Madhuban Circle,Official App,Low,Neutral
"Andhera hai Bright School me, lights fix karo.",electricity,Karelibaug,Bright School,Official App,Medium,Negative
Help needed: Heavy rain caused flooding near Abhilasha Char Rasta. Calling municipal corporation.,flooding,Sama,Abhilasha Char Rasta,Social Media,High,Negative
Alert: Accident ho gaya hai Sayajipura me. Very dangerous situation.,accident,Ajwa Road,Sayajipura,WhatsApp,High,Negative
Urgent: Low pressure water in Parshuram Bhattha. VMC please help.,water,Sayajigunj,Parshuram Bhattha,Social Media,High,Negative
Action required: Low pressure water in Kothi Kacheri. Very dangerous situation.,water,Raopura,Kothi Kacheri,Social Media,High,Negative
Urgent: Stray cattle blocking traffic at Sayajigunj. #Vadodara #VMC,other,Sayajigunj,Sayajigunj,Social Media,High,Negative
Loudspeaker noise disturbing residents in Kothi Kacheri.,other,Raopura,Kothi Kacheri,Official App,Low,Negative
Report: Too many stray dogs in Parivar Char Rasta attacking people. Please resolve asap.,other,Waghodia Road,Parivar Char Rasta,Social Media,Medium,Negative
"Please check: Andhera hai Harni Warasia Ring Road me, lights fix karo. It is very annoying.",electricity,Harni,Harni Warasia Ring Road,WhatsApp,Medium,Negative
Urgent: Sweepers not coming to Leprosy Ground regularly. Very dangerous situation.,garbage,Ajwa Road,Leprosy Ground,Social Media,Low,Negative
Huge traffic jam at Sayajipura.,traffic,Ajwa Road,Sayajipura,Official App,Medium,Negative
Heavy rain predicted for Industrial Area this evening.,weather,Nandesari,Industrial Area,Official App,Low,Neutral
Action required: Water pipeline leakage near Tandalja Road. VMC please help.,water,Vasna Road,Tandalja Road,Social Media,Medium,Negative
Help needed: Contaminated water supply in Nandesari.,water,Nandesari,Nandesari,Social Media,High,Negative
Ganda paani aa raha hai Kala Ghoda Circle me. VMC please help.,water,Kala Ghoda,Kala Ghoda Circle,Social Media,Medium,Negative
Street lights not working in Narhari Hospital.,electricity,Fatehgunj,Narhari Hospital,News Headline,Medium,Negative
"Car collision at Novino Battery, ambulance needed.",accident,Makarpura,Novino Battery,News Headline,High,Negative
Action required: No water supply in Leprosy Ground since morning. Please resolve asap.,water,Ajwa Road,Leprosy Ground,Social Media,High,Negative
"Car collision at Ajwa Road, ambulance needed.",accident,Ajwa Road,Ajwa Road,News Headline,High,Negative
Traffic signal not working at Madhuban Circle crossroads. Very dangerous situation.,traffic,Gorwa,Madhuban Circle,WhatsApp,High,Negative
Urgent: Drinking water smells bad in Novino Battery.,water,Makarpura,Novino Battery,Social Media,High,Negative
Complaint: Ganda paani aa raha hai Alkapuri me.,water,Alkapuri,Alkapuri,WhatsApp,Medium,Negative
Sweepers not coming to Saffron Tower regularly. Very dangerous situation.,garbage,Fatehgunj,Saffron Tower,Social Media,Low,Negative
Alert: Heavy traffic congestion in Subhanpura during peak hours. It's been a week.,traffic,Subhanpura,Subhanpura,Social Media,Medium,Negative
Urgent: Need a traffic policeman at Kala Ghoda junction. Please resolve asap.,traffic,Kala Ghoda,Kala Ghoda,Social Media,High,Negative
Urgent: Voltage fluctuation damaged appliances in ONGC Main Gate. Authorities please take note.,electricity,Tarsali,ONGC Main Gate,Social Media,High,Negative
Alert: Street lights not working in Tandalja Road. Very dangerous situation.,electricity,Vasna Road,Tandalja Road,WhatsApp,High,Negative
Complaint: Yellow water coming from tap in Vasna Road. Very dangerous situation.,water,Vasna Road,Vasna Road,Social Media,High,Negative
Heavy rain caused flooding near Sardar Estate.,flooding,Ajwa Road,Sardar Estate,Official App,High,Negative
Dustbins are overflowing at Windsor Plaza.,garbage,Alkapuri,Windsor Plaza,Official App,High,Negative
No water supply in Gotri since morning.,water,Gotri,Gotri,Official App,High,Negative
Pedestrian hit by a speeding car in Harni Airport.,accident,Harni,Harni Airport,Official App,High,Negative
Action required: Terrible accident on Iskcon Temple main road. It is very annoying.,accident,Gotri,Iskcon Temple,WhatsApp,High,Negative
No water supply in Tarsali since morning. Authorities please take note.,water,Tarsali,Tarsali,WhatsApp,High,Negative
Complaint: Vishwamitri river water entering Sama Savli Road low lying areas. Authorities please take note.,flooding,Sama,Sama Savli Road,Social Media,High,Negative
Alert: Susen Circle bridge is blocked due to heavy traffic. Calling municipal corporation.,traffic,Tarsali,Susen Circle,Social Media,Medium,Negative
Urgent: Cows sitting in the middle of Fatehgunj Circle road. It is very annoying.,other,Fatehgunj,Fatehgunj Circle,WhatsApp,High,Negative
Complaint: Drainage overflow causing water to unexpected levels in Akota Stadium. It's been a week.,flooding,Akota,Akota Stadium,WhatsApp,High,Negative
Urgent: Tree fallen on road in Madhuban Circle. Please resolve asap.,other,Gorwa,Madhuban Circle,WhatsApp,High,Negative
Action required: Loudspeaker noise disturbing residents in Vasna Bhayli Road. It is very annoying.,other,Vasna Road,Vasna Bhayli Road,WhatsApp,Low,Negative
Help needed: Traffic signal not working at Fatehgunj crossroads. #Vadodara #VMC,traffic,Fatehgunj,Fatehgunj,Social Media,Medium,Negative
Action required: Barish ka paani Sama Pond me bhar gaya hai. It's been a week.,flooding,Sama,Sama Pond,WhatsApp,High,Negative
Urgent: Vishwamitri river water entering Sayajigunj low lying areas. VMC please help.,flooding,Sayajigunj,Sayajigunj,WhatsApp,High,Negative
Action required: Blinkering street lights at Sama crossroad. Please resolve asap.,electricity,Sama,Sama,Social Media,Medium,Negative
Please check: Contaminated water supply in Gotri Hospital. It's been a week.,water,Gotri,Gotri Hospital,Social Media,High,Negative
Urgent: Heavy rain predicted for Kala Ghoda Circle this evening. Very dangerous situation.,weather,Kala Ghoda,Kala Ghoda Circle,Social Media,Low,Neutral
Help needed: Bahut traffic hai Akota par. Please resolve asap.,traffic,Akota,Akota,Social Media,Medium,Negative
Bike slipped due to oil spill near Sursagar Lake.,accident,Nyay Mandir,Sursagar Lake,News Headline,High,Negative
Urgent: Sursagar Lake bridge is blocked due to heavy traffic. Please resolve asap.,traffic,Nyay Mandir,Sursagar Lake,Social Media,High,Negative
Action required: Accident ho gaya hai Makarpura me. #Vadodara #VMC,accident,Makarpura,Makarpura,Social Media,High,Negative
Urgent: Electric pole looking dangerous in Kadak Bazar. It is very annoying.,electricity,Sayajigunj,Kadak Bazar,Social Media,High,Negative
Urgent: Stray cattle blocking traffic at Samta. It is very annoying.,other,Subhanpura,Samta,WhatsApp,High,Negative
Strong winds blowing in Nandesari.,weather,Nandesari,Nandesari,Official App,Low,Neutral
Action required: Street lights not working in GIDC Manjalpur.,electricity,Manjalpur,GIDC Manjalpur,Social Media,Medium,Negative
Dustbins are overflowing at Kadak Bazar.,garbage,Sayajigunj,Kadak Bazar,Official App,High,Negative
Report: Drinking water smells bad in Sayajipura. It is very annoying.,water,Ajwa Road,Sayajipura,Social Media,Medium,Negative
"Heatwave alert for Lehripura Gate, stay indoors. Authorities please take note.",weather,Mandvi,Lehripura Gate,WhatsApp,Medium,Negative
Action required: Bright School Vasna bridge is blocked due to heavy traffic. Authorities please take note.,traffic,Vasna Road,Bright School Vasna,WhatsApp,Medium,Negative
Vishwamitri river water entering Tandalja Road low lying areas.,flooding,Vasna Road,Tandalja Road,News Headline,High,Negative
"Complaint: Car collision at Chemical Zone, ambulance needed. It's been a week.",accident,Nandesari,Chemical Zone,Social Media,High,Negative
Heavy traffic congestion in Sayajigunj during peak hours.,traffic,Sayajigunj,Sayajigunj,Official App,Medium,Negative
Low pressure water in GMERS.,water,Gotri,GMERS,News Headline,Medium,Negative
Alert: Need a traffic policeman at Harni Warasia Ring Road junction. It's been a week.,traffic,Harni,Harni Warasia Ring Road,WhatsApp,Medium,Negative
Please check: Cleaning not done in Akota Bridge society. Authorities please take note.,garbage,Akota,Akota Bridge,Social Media,Medium,Negative
Complaint: Heavy rain predicted for Mandvi this evening.,weather,Mandvi,Mandvi,WhatsApp,Low,Neutral
Help needed: No electricity in Kala Ghoda for 4 hours. Authorities please take note.,electricity,Kala Ghoda,Kala Ghoda,Social Media,Medium,Negative
"Heatwave alert for Bright School, stay indoors.",weather,Karelibaug,Bright School,News Headline,Medium,Negative
Water logging issue at Nandesari GIDC.,flooding,Nandesari,Nandesari GIDC,Official App,High,Negative
Unseasonal rain in Motnath Mahadev.,weather,Harni,Motnath Mahadev,News Headline,Low,Neutral
Alert: Unseasonal rain in Saffron Tower.,weather,Fatehgunj,Saffron Tower,WhatsApp,Medium,Negative
Complaint: Voltage fluctuation damaged appliances in Rajmahal Road.,electricity,Nyay Mandir,Rajmahal Road,Social Media,Medium,Negative
"Help needed: Heatwave alert for Mandvi Gate, stay indoors. Calling municipal corporation.",weather,Mandvi,Mandvi Gate,Social Media,Medium,Negative
Cows sitting in the middle of Fatehgunj road.,other,Fatehgunj,Fatehgunj,WhatsApp,Medium,Negative
Urgent: Traffic signal not working at Nyay Mandir crossroads. Calling municipal corporation.,traffic,Nyay Mandir,Nyay Mandir,WhatsApp,High,Negative
Help needed: Water pipeline leakage near Makarpura. Authorities please take note.,water,Makarpura,Makarpura,WhatsApp,Medium,Negative
"Report: Knee deep water in Kala Ghoda Circle, please help. Very dangerous situation.",flooding,Kala Ghoda,Kala Ghoda Circle,WhatsApp,High,Negative
Barish ka paani Parshuram Bhattha me bhar gaya hai.,flooding,Sayajigunj,Parshuram Bhattha,News Headline,High,Negative
Please check: Garbage not collected in Makarpura GIDC for 3 days. Authorities please take note.,garbage,Makarpura,Makarpura GIDC,Social Media,Medium,Negative
"Knee deep water in Mujmahuda, please help.",flooding,Akota,Mujmahuda,News Headline,High,Negative
No electricity in Samta for 4 hours.,electricity,Subhanpura,Samta,Official App,Medium,Negative
Report: Bahut traffic hai Parivar Char Rasta par. It's been a week.,traffic,Waghodia Road,Parivar Char Rasta,WhatsApp,Medium,Negative
Please check: Accident prone zone near Gorwa school needs speed breaker. Calling municipal corporation.,accident,Gorwa,Gorwa,Social Media,High,Negative
Traffic signal not working at Sama crossroads.,traffic,Sama,Sama,Official App,Medium,Negative
Frequent power cuts in Mental Hospital since yesterday.,electricity,Karelibaug,Mental Hospital,Official App,Medium,Negative
Stray animal menace in Raopura.,other,Raopura,Raopura,News Headline,Medium,Negative
"Alert: Car collision at Dairy Den Circle, ambulance needed. #Vadodara #VMC",accident,Sayajigunj,Dairy Den Circle,Social Media,High,Negative
"Heatwave alert for Tandalja Road, stay indoors. It is very annoying.",weather,Vasna Road,Tandalja Road,Social Media,Medium,Negative
Complaint: Pile of trash blocking the footpath in D-Mart Waghodia.,garbage,Waghodia Road,D-Mart Waghodia,Social Media,Medium,Negative
Contaminated water supply in Concorde Building.,water,Alkapuri,Concorde Building,Official App,High,Negative
Action required: Heavy traffic congestion in Jubilee Baug during peak hours. Calling municipal corporation.,traffic,Raopura,Jubilee Baug,Social Media,Medium,Negative
Urgent: Cars parked illegally on Parshuram Bhattha road causing jam. VMC please help.,traffic,Sayajigunj,Parshuram Bhattha,WhatsApp,High,Negative
Water is not draining in Iskcon Temple.,flooding,Gotri,Iskcon Temple,News Headline,High,Negative
Cars parked illegally on ONGC Main Gate road causing jam.,traffic,Tarsali,ONGC Main Gate,Official App,Medium,Negative
Stray cattle blocking traffic at Mental Hospital.,other,Karelibaug,Mental Hospital,Official App,Medium,Negative
No water supply in Parivar Char Rasta since morning.,water,Waghodia Road,Parivar Char Rasta,Social Media,High,Negative
Complaint: Voltage fluctuation damaged appliances in Harni. VMC please help.,electricity,Harni,Harni,WhatsApp,Medium,Negative
Help needed: Bus hit a divider in D-Mart Waghodia. It is very annoying.,accident,Waghodia Road,D-Mart Waghodia,Social Media,High,Negative
Report: Terrible accident on High Tension Road main road. VMC please help.,accident,Subhanpura,High Tension Road,Social Media,High,Negative
Unseasonal rain in Tandalja Road.,weather,Vasna Road,Tandalja Road,News Headline,Low,Neutral
It's extremely hot in Novino Battery today.,weather,Makarpura,Novino Battery,Official App,Low,Neutral
Please check: Bus hit a divider in Industrial Area.,accident,Nandesari,Industrial Area,WhatsApp,High,Negative
Stray cattle blocking traffic at Mental Hospital.,other,Karelibaug,Mental Hospital,Social Media,Medium,Negative
Water logging issue at Mental Hospital.,flooding,Karelibaug,Mental Hospital,Official App,High,Negative
Complaint: Dead animal near Vasna Bhayli Road needs removal. VMC please help.,garbage,Vasna Road,Vasna Bhayli Road,WhatsApp,High,Negative
Report: Pedestrian hit by a speeding car in Khanderao Market. It's been a week.,accident,Nyay Mandir,Khanderao Market,Social Media,High,Negative
Report: Unseasonal rain in Mandvi. Authorities please take note.,weather,Mandvi,Mandvi,WhatsApp,Low,Neutral
"Please check: Knee deep water in Vasna Bhayli Road, please help. It is very annoying.",flooding,Vasna Road,Vasna Bhayli Road,WhatsApp,High,Negative
Alert: Frequent power cuts in Tandalja Road since yesterday. It is very annoying.,electricity,Vasna Road,Tandalja Road,WhatsApp,Medium,Negative
Action required: Thunderstorm expected in Samta. It is very annoying.,weather,Subhanpura,Samta,Social Media,Low,Neutral
Help needed: Water logging issue at High Tension Road. It's been a week.,flooding,Subhanpura,High Tension Road,WhatsApp,High,Negative
Action required: Drinking water smells bad in Cow Circle. VMC please help.,water,Akota,Cow Circle,Social Media,Medium,Negative
Bus hit a divider in Harinagar.,accident,Gotri,Harinagar,Official App,High,Negative
Alert: Barish ka paani Subhanpura Wadi me bhar gaya hai. Authorities please take note.,flooding,Subhanpura,Subhanpura Wadi,WhatsApp,High,Negative
Cows sitting in the middle of Dandia Bazar road.,other,Raopura,Dandia Bazar,Official App,Medium,Negative
Report: Vishwamitri river water entering High Tension Road low lying areas. Calling municipal corporation.,flooding,Subhanpura,High Tension Road,Social Media,High,Negative
Action required: Unknown person loitering suspiciously in Tandalja Road. Please resolve asap.,other,Vasna Road,Tandalja Road,WhatsApp,Low,Negative
Kachra pada hai Kala Ghoda road pe.,garbage,Kala Ghoda,Kala Ghoda,News Headline,Medium,Negative
Heavy traffic congestion in Kala Ghoda during peak hours.,traffic,Kala Ghoda,Kala Ghoda,News Headline,Medium,Negative
"Report: Car collision at Sayajigunj, ambulance needed. Please resolve asap.",accident,Sayajigunj,Sayajigunj,WhatsApp,High,Negative
Bike slipped due to oil spill near Leprosy Ground.,accident,Ajwa Road,Leprosy Ground,News Headline,High,Negative
Vishwamitri river water entering Bright School Vasna low lying areas.,flooding,Vasna Road,Bright School Vasna,News Headline,High,Negative
Cleaning not done in Susen Circle society. Very dangerous situation.,garbage,Tarsali,Susen Circle,WhatsApp,High,Negative
Urgent: Yellow water coming from tap in Dairy Den Circle. It's been a week.,water,Sayajigunj,Dairy Den Circle,WhatsApp,High,Negative
Unseasonal rain in Uma Char Rasta.,weather,Waghodia Road,Uma Char Rasta,News Headline,Low,Neutral
Low pressure water in Shreyas School. Calling municipal corporation.,water,Manjalpur,Shreyas School,WhatsApp,Medium,Negative
Heavy rain predicted for Alkapuri this evening. Please resolve asap.,weather,Alkapuri,Alkapuri,Social Media,Low,Neutral
Ganda paani aa raha hai GMERS me.,water,Gotri,GMERS,Official App,Medium,Negative
Alert: Cars parked illegally on Sursagar Lake road causing jam. Very dangerous situation.,traffic,Nyay Mandir,Sursagar Lake,WhatsApp,High,Negative
Action required: Illegal encroachment on footpath in Central Library. VMC please help.,other,Mandvi,Central Library,Social Media,Medium,Negative
Ganda paani aa raha hai Eva Mall me.,water,Manjalpur,Eva Mall,News Headline,Medium,Negative
Ganda paani aa raha hai Motnath Mahadev me.,water,Harni,Motnath Mahadev,News Headline,Medium,Negative
Alert: Dead animal near Central Library needs removal. It is very annoying.,garbage,Mandvi,Central Library,WhatsApp,High,Negative
Help needed: Thunderstorm expected in Susen Circle. It's been a week.,weather,Tarsali,Susen Circle,Social Media,Low,Neutral
Dustbins are overflowing at Narhari Hospital.,garbage,Fatehgunj,Narhari Hospital,News Headline,High,Negative
Huge traffic jam at Saffron Tower.,traffic,Fatehgunj,Saffron Tower,News Headline,Medium,Negative
"Report: Andhera hai Lehripura Gate me, lights fix karo. Please resolve asap.",electricity,Mandvi,Lehripura Gate,WhatsApp,Medium,Negative
"Alert: Heatwave alert for Susen Tarsali Ring Road, stay indoors. It is very annoying.",weather,Makarpura,Susen Tarsali Ring Road,Social Media,Medium,Negative
Help needed: Drainage overflow causing water to unexpected levels in Karelibaug.,flooding,Karelibaug,Karelibaug,WhatsApp,High,Negative
Action required: Bohat garmi hai Vasna Road me aaj. Calling municipal corporation.,weather,Vasna Road,Vasna Road,Social Media,Low,Neutral
Water pipeline leakage near Manjalpur.,water,Manjalpur,Manjalpur,Official App,Medium,Negative
Action required: Drainage overflow causing water to unexpected levels in Kala Ghoda Circle.,flooding,Kala Ghoda,Kala Ghoda Circle,Social Media,High,Negative
"Action required: Heatwave alert for Gotri, stay indoors. Please resolve asap.",weather,Gotri,Gotri,WhatsApp,Medium,Negative
Help needed: Thunderstorm expected in Sardar Estate. It's been a week.,weather,Ajwa Road,Sardar Estate,WhatsApp,Low,Neutral
Traffic signal not working at Windsor Plaza crossroads.,traffic,Alkapuri,Windsor Plaza,News Headline,Medium,Negative
Help needed: Heavy rain caused flooding near Motnath Mahadev. Authorities please take note.,flooding,Harni,Motnath Mahadev,Social Media,High,Negative
Urgent: Contaminated water supply in Narhari Hospital. Please resolve asap.,water,Fatehgunj,Narhari Hospital,WhatsApp,High,Negative
"Please check: Heatwave alert for Susen Tarsali Ring Road, stay indoors. VMC please help.",weather,Makarpura,Susen Tarsali Ring Road,Social Media,Medium,Negative
Alert: Garbage not collected in Tarsali for 3 days. Calling municipal corporation.,garbage,Tarsali,Tarsali,WhatsApp,Medium,Negative
Alert: Yellow water coming from tap in Concorde Building. It is very annoying.,water,Alkapuri,Concorde Building,WhatsApp,Medium,Negative
Help needed: Loudspeaker noise disturbing residents in Tarsali Bypass. It's been a week.,other,Tarsali,Tarsali Bypass,Social Media,Low,Negative
Report: Bahut traffic hai Makarpura GIDC par. Authorities please take note.,traffic,Makarpura,Makarpura GIDC,Social Media,Medium,Negative
GMERS bridge is blocked due to heavy traffic.,traffic,Gotri,GMERS,Official App,Medium,Negative
Urgent: It's extremely hot in Nandesari today. Please resolve asap.,weather,Nandesari,Nandesari,Social Media,Low,Neutral
Heavy rain predicted for Motnath Mahadev this evening.,weather,Harni,Motnath Mahadev,Official App,Low,Neutral
Urgent: It's extremely hot in Manjalpur Naka today. It's been a week.,weather,Manjalpur,Manjalpur Naka,WhatsApp,Low,Neutral
Report: Dustbins are overflowing at Lehripura Gate. Calling municipal corporation.,garbage,Mandvi,Lehripura Gate,Social Media,High,Negative
Tree fallen on road in Bright School.,other,Karelibaug,Bright School,News Headline,Medium,Negative
No electricity in Champaner Gate for 4 hours.,electricity,Mandvi,Champaner Gate,Official App,Medium,Negative
Alert: Low pressure water in Kadak Bazar.,water,Sayajigunj,Kadak Bazar,Social Media,Medium,Negative
Barish ka paani Windsor Plaza me bhar gaya hai.,flooding,Alkapuri,Windsor Plaza,Official App,High,Negative
Help needed: Frequent power cuts in Eva Mall since yesterday. Calling municipal corporation.,electricity,Manjalpur,Eva Mall,Social Media,Medium,Negative
Please check: Iskcon Temple is completely dark at night. VMC please help.,electricity,Gotri,Iskcon Temple,WhatsApp,High,Negative
Alert: Terrible accident on Harni Airport main road. Authorities please take note.,accident,Harni,Harni Airport,Social Media,High,Negative
Urgent: Kachra pada hai Harinagar road pe. Authorities please take note.,garbage,Gotri,Harinagar,Social Media,High,Negative
Action required: Cows sitting in the middle of Abhilasha Char Rasta road. It's been a week.,other,Sama,Abhilasha Char Rasta,WhatsApp,Medium,Negative
Urgent: Rajmahal Road is completely submerged. It is very annoying.,flooding,Nyay Mandir,Rajmahal Road,WhatsApp,High,Negative
Stray animal menace in Gorwa.,other,Gorwa,Gorwa,News Headline,Medium,Negative
Yellow water coming from tap in Rajmahal Road.,water,Nyay Mandir,Rajmahal Road,Official App,Medium,Negative
Action required: Terrible accident on Central Library main road. Very dangerous situation.,accident,Mandvi,Central Library,Social Media,High,Negative
Alert: Ganda paani aa raha hai Vasna Bhayli Road me. It's been a week.,water,Vasna Road,Vasna Bhayli Road,Social Media,Medium,Negative
Report: Bohat garmi hai Tarsali Bypass me aaj. Calling municipal corporation.,weather,Tarsali,Tarsali Bypass,Social Media,Low,Neutral
Complaint: Sweepers not coming to Windsor Plaza regularly. It is very annoying.,garbage,Alkapuri,Windsor Plaza,Social Media,Low,Negative
Action required: Foul smell coming from garbage dump in Gotri Hospital. Calling municipal corporation.,garbage,Gotri,Gotri Hospital,Social Media,Medium,Negative
Action required: Sweepers not coming to Mandvi regularly. It is very annoying.,garbage,Mandvi,Mandvi,Social Media,Low,Negative
Please check: No water supply in Mental Hospital since morning. It is very annoying.,water,Karelibaug,Mental Hospital,WhatsApp,High,Negative
Alert: Stray cattle blocking traffic at Abhilasha Char Rasta. Very dangerous situation.,other,Sama,Abhilasha Char Rasta,WhatsApp,High,Negative
"Complaint: Heatwave alert for Muktanand Three Roads, stay indoors. #Vadodara #VMC",weather,Karelibaug,Muktanand Three Roads,Social Media,Medium,Negative
Urgent: Dead animal near Kadak Bazar needs removal. Please resolve asap.,garbage,Sayajigunj,Kadak Bazar,WhatsApp,High,Negative
Report: Drainage overflow causing water to unexpected levels in Ajwa Chokdi. It is very annoying.,flooding,Ajwa Road,Ajwa Chokdi,Social Media,High,Negative
Alert: Water logging issue at Nandesari GIDC.,flooding,Nandesari,Nandesari GIDC,WhatsApp,High,Negative
"Action required: Car collision at RC Dutt Road, ambulance needed. VMC please help.",accident,Alkapuri,RC Dutt Road,Social Media,High,Negative
No electricity in Ajwa Chokdi for 4 hours.,electricity,Ajwa Road,Ajwa Chokdi,News Headline,Medium,Negative
