text,category,location_label,location_mention,source,severity,sentiment
Help needed: Vishwamitri river water entering Waghodia Road low lying areas. Very dangerous situation.,flooding,Waghodia Road,Waghodia Road,WhatsApp,High,Negative
Report: Voltage fluctuation damaged appliances in Mental Hospital. It's been a week.,electricity,Karelibaug,Mental Hospital,WhatsApp,Medium,Negative
Barish ka paani Subhanpura Wadi me bhar gaya hai.,flooding,Subhanpura,Subhanpura Wadi,Official App,High,Negative
"Please check: Knee deep water in Madhuban Circle, please help. Calling municipal corporation.",flooding,Gorwa,Madhuban Circle,WhatsApp,High,Negative
Terrible accident on Harinagar main road.,accident,Gotri,Harinagar,WhatsApp,High,Negative
Report: Vishwamitri river water entering Mental Hospital low lying areas. Calling municipal corporation.,flooding,Karelibaug,Mental Hospital,WhatsApp,High,Negative
Urgent: Cows sitting in the middle of Mandvi Gate road. Calling municipal corporation.,other,Mandvi,Mandvi Gate,Social Media,High,Negative
Accident ho gaya hai ONGC Main Gate me. It's been a week.,accident,Tarsali,ONGC Main Gate,Social Media,High,Negative
Report: Stray cattle blocking traffic at Ajwa Road. It is very annoying.,other,Ajwa Road,Ajwa Road,Social Media,Medium,Negative
Action required: Bahut traffic hai Manjalpur Naka par. Authorities please take note.,traffic,Manjalpur,Manjalpur Naka,Social Media,Medium,Negative
Tree fallen on road in Kala Ghoda Circle.,other,Kala Ghoda,Kala Ghoda Circle,Official App,Medium,Negative
Please check: Cleaning not done in Eva Mall society. Please resolve asap.,garbage,Manjalpur,Eva Mall,WhatsApp,Medium,Negative
Alert: Wrong side driving is rampant in Dandia Bazar. It is very annoying.,traffic,Raopura,Dandia Bazar,Social Media,Medium,Negative
Electric pole looking dangerous in Circuit House.,electricity,Alkapuri,Circuit House,Official App,High,Negative
Complaint: Garden maintenance needed in Harni. It is very annoying.,other,Harni,Harni,WhatsApp,Low,Negative
Help needed: Unseasonal rain in Manjalpur. Very dangerous situation.,weather,Manjalpur,Manjalpur,Social Media,Low,Neutral
Alert: Ganda paani aa raha hai Jubilee Baug me. VMC please help.,water,Raopura,Jubilee Baug,Social Media,Medium,Negative
Report: Accident prone zone near Gorwa BIDC school needs speed breaker. It's been a week.,accident,Gorwa,Gorwa BIDC,WhatsApp,High,Negative
Complaint: No water supply in Abhilasha Char Rasta since morning.,water,Sama,Abhilasha Char Rasta,WhatsApp,High,Negative
Complaint: Blinkering street lights at Bright School Vasna crossroad. It is very annoying.,electricity,Vasna Road,Bright School Vasna,WhatsApp,Medium,Negative
Bus hit a divider in Akota.,accident,Akota,Akota,Official App,High,Negative
Alert: Stray cattle blocking traffic at Makarpura. Calling municipal corporation.,other,Makarpura,Makarpura,Social Media,Medium,Negative
Traffic signal not working at Sursagar Lake crossroads. Calling municipal corporation.,traffic,Nyay Mandir,Sursagar Lake,Social Media,Medium,Negative
Report: Need a traffic policeman at Susen Tarsali Ring Road junction. Authorities please take note.,traffic,Makarpura,Susen Tarsali Ring Road,Social Media,Medium,Negative
Accident prone zone near Sursagar Lake school needs speed breaker. Calling municipal corporation.,accident,Nyay Mandir,Sursagar Lake,Social Media,High,Negative
Report: Drainage overflow causing water to unexpected levels in RC Dutt Road. Authorities please take note.,flooding,Alkapuri,RC Dutt Road,WhatsApp,High,Negative
Please check: Sweepers not coming to Jubilee Baug regularly. VMC please help.,garbage,Raopura,Jubilee Baug,WhatsApp,Low,Negative
Alert: Drainage overflow causing water to unexpected levels in Narhari Hospital. VMC please help.,flooding,Fatehgunj,Narhari Hospital,WhatsApp,High,Negative
"Complaint: Car collision at Cow Circle, ambulance needed.",accident,Akota,Cow Circle,WhatsApp,High,Negative
Report: Cleaning not done in Sayajigunj society. Calling municipal corporation.,garbage,Sayajigunj,Sayajigunj,Social Media,Medium,Negative
Alert: Pedestrian hit by a speeding car in Susen Circle. VMC please help.,accident,Tarsali,Susen Circle,Social Media,High,Negative
Strong winds blowing in Mandvi Gate.,weather,Mandvi,Mandvi Gate,News Headline,Low,Neutral
Alert: Voltage fluctuation damaged appliances in Railway Station. It is very annoying.,electricity,Sayajigunj,Railway Station,WhatsApp,Medium,Negative
Report: Unknown person loitering suspiciously in ITI Gorwa. Authorities please take note.,other,Gorwa,ITI Gorwa,Social Media,Low,Negative
Too many stray dogs in Iskcon Temple attacking people.,other,Gotri,Iskcon Temple,WhatsApp,Medium,Negative
Kala Ghoda is completely submerged.,flooding,Kala Ghoda,Kala Ghoda,Official App,High,Negative
Cars parked illegally on Waghodia Road road causing jam.,traffic,Waghodia Road,Waghodia Road,Official App,Medium,Negative
Water logging issue at Akota Bridge.,flooding,Akota,Akota Bridge,Official App,High,Negative
Complaint: Accident prone zone near GMERS school needs speed breaker. It's been a week.,accident,Gotri,GMERS,Social Media,High,Negative
Bike slipped due to oil spill near Akota Stadium. It's been a week.,accident,Akota,Akota Stadium,WhatsApp,High,Negative
Complaint: Cows sitting in the middle of GIDC Manjalpur road. Calling municipal corporation.,other,Manjalpur,GIDC Manjalpur,WhatsApp,Medium,Negative
Action required: Stray animal menace in Samta. Authorities please take note.,other,Subhanpura,Samta,Social Media,Medium,Negative
Help needed: Sweepers not coming to GMERS regularly. It is very annoying.,garbage,Gotri,GMERS,Social Media,Low,Negative
Action required: It's extremely hot in Subhanpura today. Authorities please take note.,weather,Subhanpura,Subhanpura,Social Media,Low,Neutral
Bike slipped due to oil spill near Ajwa Chokdi.,accident,Ajwa Road,Ajwa Chokdi,Official App,High,Negative
Action required: Illegal encroachment on footpath in Abhilasha Char Rasta. It is very annoying.,other,Sama,Abhilasha Char Rasta,Social Media,Medium,Negative
Ganda paani aa raha hai Manjalpur me. It is very annoying.,water,Manjalpur,Manjalpur,Social Media,Medium,Negative
Unseasonal rain in Madhuban Circle.,weather,Gorwa,Madhuban Circle,Official App,Low,Neutral
No electricity in Mandvi Gate for 4 hours.,electricity,Mandvi,Mandvi Gate,Official App,Medium,Negative
Urgent: Sayajigunj is completely dark at night. #Vadodara #VMC,electricity,Sayajigunj,Sayajigunj,Social Media,High,Negative
Urgent: Bohat garmi hai Karelibaug me aaj.,weather,Karelibaug,Karelibaug,Social Media,Low,Neutral
Alert: Low pressure water in Eva Mall. #Vadodara #VMC,water,Manjalpur,Eva Mall,Social Media,Medium,Negative
No electricity in Abhilasha Char Rasta for 4 hours.,electricity,Sama,Abhilasha Char Rasta,News Headline,Medium,Negative
Heavy rain predicted for Nandesari this evening.,weather,Nandesari,Nandesari,Official App,Low,Neutral
Accident ho gaya hai Nyay Mandir me.,accident,Nyay Mandir,Nyay Mandir,Official App,High,Negative
Bahut traffic hai Ajwa Road par.,traffic,Ajwa Road,Ajwa Road,Official App,Medium,Negative
Sweepers not coming to Nandesari GIDC regularly. #Vadodara #VMC,garbage,Nandesari,Nandesari GIDC,Social Media,Low,Negative
Please check: Thunderstorm expected in Karelibaug. Very dangerous situation.,weather,Karelibaug,Karelibaug,Social Media,Low,Neutral
Street lights not working in Khanderao Market.,electricity,Nyay Mandir,Khanderao Market,News Headline,Medium,Negative
Urgent: Stray cattle blocking traffic at Sarabhai Compound. Calling municipal corporation.,other,Kala Ghoda,Sarabhai Compound,Social Media,High,Negative
Street lights not working in D-Mart Waghodia.,electricity,Waghodia Road,D-Mart Waghodia,Official App,Medium,Negative
Mujmahuda is completely submerged. It's been a week.,flooding,Akota,Mujmahuda,WhatsApp,High,Negative
Street lights not working in ONGC Main Gate.,electricity,Tarsali,ONGC Main Gate,Official App,Medium,Negative
Yellow water coming from tap in Fatehgunj Circle.,water,Fatehgunj,Fatehgunj Circle,Official App,Medium,Negative
Low pressure water in Nyay Mandir.,water,Nyay Mandir,Nyay Mandir,Official App,Medium,Negative
Bike slipped due to oil spill near Kala Ghoda. It's been a week.,accident,Kala Ghoda,Kala Ghoda,Social Media,High,Negative
Low pressure water in MS University Hostel.,water,Fatehgunj,MS University Hostel,Official App,Medium,Negative
Action required: Blinkering street lights at Dandia Bazar crossroad. Authorities please take note.,electricity,Raopura,Dandia Bazar,WhatsApp,Medium,Negative
Report: Heavy rain predicted for Dairy Den Circle this evening.,weather,Sayajigunj,Dairy Den Circle,WhatsApp,Low,Neutral
Bohat garmi hai Khanderao Market me aaj.,weather,Nyay Mandir,Khanderao Market,Official App,Low,Neutral
Action required: Low pressure water in Khanderao Market. Please resolve asap.,water,Nyay Mandir,Khanderao Market,Social Media,Medium,Negative
Report: Gotri bridge is blocked due to heavy traffic.,traffic,Gotri,Gotri,Social Media,Medium,Negative
Urgent: Stray cattle blocking traffic at Vrindavan Char Rasta.,other,Waghodia Road,Vrindavan Char Rasta,Social Media,High,Negative
Complaint: Drainage overflow causing water to unexpected levels in Champaner Gate.,flooding,Mandvi,Champaner Gate,Social Media,High,Negative
Please check: Accident ho gaya hai Bright School Vasna me. It's been a week.,accident,Vasna Road,Bright School Vasna,Social Media,High,Negative
Please check: Heavy rain predicted for Dandia Bazar this evening. Please resolve asap.,weather,Raopura,Dandia Bazar,Social Media,Low,Neutral
Alert: Low pressure water in Makarpura. Calling municipal corporation.,water,Makarpura,Makarpura,Social Media,Medium,Negative
Report: Accident prone zone near Susen Tarsali Ring Road school needs speed breaker. #Vadodara #VMC,accident,Makarpura,Susen Tarsali Ring Road,Social Media,High,Negative
Bus hit a divider in Tarsali.,accident,Tarsali,Tarsali,Official App,High,Negative
Cars parked illegally on Harni Airport road causing jam.,traffic,Harni,Harni Airport,Official App,Medium,Negative
Complaint: Cars parked illegally on D-Mart Waghodia road causing jam. It is very annoying.,traffic,Waghodia Road,D-Mart Waghodia,Social Media,Medium,Negative
No water supply in Ajwa Road since morning. VMC please help.,water,Ajwa Road,Ajwa Road,WhatsApp,High,Negative
Help needed: Water logging issue at Mujmahuda. Calling municipal corporation.,flooding,Akota,Mujmahuda,Social Media,High,Negative
Alert: Too many stray dogs in Harni attacking people. VMC please help.,other,Harni,Harni,Social Media,Medium,Negative
Very unhygienic conditions in Sursagar Lake vegetable market.,garbage,Nyay Mandir,Sursagar Lake,Social Media,Medium,Negative
Too many stray dogs in Muktanand Three Roads attacking people.,other,Karelibaug,Muktanand Three Roads,Official App,Medium,Negative
Please check: Drainage overflow causing water to unexpected levels in Sama Savli Road.,flooding,Sama,Sama Savli Road,WhatsApp,High,Negative
Complaint: Heavy traffic congestion in Gorwa BIDC during peak hours.,traffic,Gorwa,Gorwa BIDC,WhatsApp,Medium,Negative
Very unhygienic conditions in Mandvi Gate vegetable market. #Vadodara #VMC,garbage,Mandvi,Mandvi Gate,Social Media,Medium,Negative
Help needed: Water logging issue at Raopura Tower.,flooding,Raopura,Raopura Tower,WhatsApp,High,Negative
Water logging issue at Sursagar Lake.,flooding,Nyay Mandir,Sursagar Lake,News Headline,High,Negative
Action required: Cars parked illegally on Fatehgunj Circle road causing jam. Calling municipal corporation.,traffic,Fatehgunj,Fatehgunj Circle,Social Media,Medium,Negative
Yellow water coming from tap in Sarabhai Compound.,water,Kala Ghoda,Sarabhai Compound,Official App,Medium,Negative
Heavy rain caused flooding near Harinagar.,flooding,Gotri,Harinagar,News Headline,High,Negative
Help needed: No water supply in ONGC Main Gate since morning. It is very annoying.,water,Tarsali,ONGC Main Gate,WhatsApp,High,Negative
Urgent: Dead animal near Harni Warasia Ring Road needs removal. Authorities please take note.,garbage,Harni,Harni Warasia Ring Road,WhatsApp,High,Negative
Action required: Loudspeaker noise disturbing residents in Mandvi. Please resolve asap.,other,Mandvi,Mandvi,Social Media,Low,Negative
Please check: Kachra pada hai Railway Station road pe. VMC please help.,garbage,Sayajigunj,Railway Station,Social Media,Medium,Negative
Water pipeline leakage near GMERS.,water,Gotri,GMERS,Official App,Medium,Negative
Ganda paani aa raha hai Cow Circle me.,water,Akota,Cow Circle,Official App,Medium,Negative
Urgent: Loudspeaker noise disturbing residents in ITI Gorwa. VMC please help.,other,Gorwa,ITI Gorwa,WhatsApp,Low,Negative
Action required: Drinking water smells bad in Kala Ghoda. VMC please help.,water,Kala Ghoda,Kala Ghoda,WhatsApp,Medium,Negative
Urgent: Ganda paani aa raha hai Vasna Road me. Very dangerous situation.,water,Vasna Road,Vasna Road,WhatsApp,High,Negative
Traffic signal not working at Iskcon Temple crossroads.,traffic,Gotri,Iskcon Temple,Official App,Medium,Negative
Cars parked illegally on Susen Tarsali Ring Road road causing jam. #Vadodara #VMC,traffic,Makarpura,Susen Tarsali Ring Road,WhatsApp,Medium,Negative
Please check: Bike slipped due to oil spill near Harni Airport.,accident,Harni,Harni Airport,WhatsApp,High,Negative
"Heatwave alert for Gotri Hospital, stay indoors.",weather,Gotri,Gotri Hospital,Official App,Medium,Negative
No water supply in Fatehgunj Circle since morning.,water,Fatehgunj,Fatehgunj Circle,Official App,High,Negative
Contaminated water supply in Saffron Tower. Calling municipal corporation.,water,Fatehgunj,Saffron Tower,Social Media,High,Negative
Urgent: Loudspeaker noise disturbing residents in Dandia Bazar. Calling municipal corporation.,other,Raopura,Dandia Bazar,WhatsApp,Low,Negative
Action required: Water is not draining in Nandesari GIDC. Authorities please take note.,flooding,Nandesari,Nandesari GIDC,WhatsApp,High,Negative
Complaint: Heavy rain caused flooding near Champaner Gate. Authorities please take note.,flooding,Mandvi,Champaner Gate,Social Media,High,Negative
Cars parked illegally on Mujmahuda road causing jam.,traffic,Akota,Mujmahuda,News Headline,Medium,Negative
Please check: Unknown person loitering suspiciously in Concorde Building. It's been a week.,other,Alkapuri,Concorde Building,Social Media,Low,Negative
Report: Too many stray dogs in Chemical Zone attacking people. Please resolve asap.,other,Nandesari,Chemical Zone,WhatsApp,Medium,Negative
Report: Low pressure water in Tarsali. Authorities please take note.,water,Tarsali,Tarsali,Social Media,Medium,Negative
Stray cattle blocking traffic at Sardar Estate.,other,Ajwa Road,Sardar Estate,Official App,Medium,Negative
Action required: Stray animal menace in Sama Pond. Authorities please take note.,other,Sama,Sama Pond,Social Media,Medium,Negative
Unseasonal rain in Mental Hospital.,weather,Karelibaug,Mental Hospital,News Headline,Low,Neutral
Report: Water pipeline leakage near Bright School Vasna. It's been a week.,water,Vasna Road,Bright School Vasna,WhatsApp,Medium,Negative
Urgent: Heavy rain predicted for Sursagar Lake this evening. Calling municipal corporation.,weather,Nyay Mandir,Sursagar Lake,Social Media,Low,Neutral
Ganda paani aa raha hai Akota me.,water,Akota,Akota,News Headline,Medium,Negative
Alert: Bohat garmi hai Sayajigunj me aaj. #Vadodara #VMC,weather,Sayajigunj,Sayajigunj,WhatsApp,Medium,Negative
Heavy rain caused flooding near Harni Warasia Ring Road.,flooding,Harni,Harni Warasia Ring Road,Official App,High,Negative
Accident ho gaya hai Manjalpur me.,accident,Manjalpur,Manjalpur,Official App,High,Negative
Tree fallen on road in Air Force Station.,other,Makarpura,Air Force Station,Official App,Medium,Negative
Urgent: Cows sitting in the middle of Fatehgunj road. It is very annoying.,other,Fatehgunj,Fatehgunj,Social Media,High,Negative
Alert: Illegal encroachment on footpath in Bright School Vasna. Please resolve asap.,other,Vasna Road,Bright School Vasna,WhatsApp,Medium,Negative
Urgent: Yellow water coming from tap in Eva Mall. Very dangerous situation.,water,Manjalpur,Eva Mall,Social Media,High,Negative
No electricity in Harni Airport for 4 hours.,electricity,Harni,Harni Airport,News Headline,Medium,Negative
Complaint: Blinkering street lights at Cow Circle crossroad. Authorities please take note.,electricity,Akota,Cow Circle,Social Media,Medium,Negative
Alert: Water is not draining in Harni Airport. It's been a week.,flooding,Harni,Harni Airport,WhatsApp,High,Negative
Vasna Bhayli Road is completely dark at night.,electricity,Vasna Road,Vasna Bhayli Road,News Headline,High,Negative
Bahut traffic hai Raopura par. Very dangerous situation.,traffic,Raopura,Raopura,Social Media,High,Negative
Action required: Terrible accident on Subhanpura main road. Authorities please take note.,accident,Subhanpura,Subhanpura,WhatsApp,High,Negative
No electricity in Concorde Building for 4 hours.,electricity,Alkapuri,Concorde Building,Official App,Medium,Negative
Complaint: Unseasonal rain in Harni Airport. #Vadodara #VMC,weather,Harni,Harni Airport,WhatsApp,Low,Neutral
Thunderstorm expected in Subhanpura.,weather,Subhanpura,Subhanpura,News Headline,Low,Neutral
Action required: Accident ho gaya hai Parivar Char Rasta me. VMC please help.,accident,Waghodia Road,Parivar Char Rasta,WhatsApp,High,Negative
Dustbins are overflowing at Makarpura GIDC. It is very annoying.,garbage,Makarpura,Makarpura GIDC,WhatsApp,High,Negative
Water is not draining in Susen Tarsali Ring Road.,flooding,Makarpura,Susen Tarsali Ring Road,Official App,High,Negative
Please check: Bohat garmi hai Circuit House me aaj. Please resolve asap.,weather,Alkapuri,Circuit House,WhatsApp,Low,Neutral
Complaint: Bohat garmi hai ONGC Main Gate me aaj. It is very annoying.,weather,Tarsali,ONGC Main Gate,Social Media,Low,Neutral
Alert: Drinking water smells bad in Rajmahal Road. Very dangerous situation.,water,Nyay Mandir,Rajmahal Road,WhatsApp,High,Negative
Help needed: Thunderstorm expected in RC Dutt Road. Very dangerous situation.,weather,Alkapuri,RC Dutt Road,Social Media,Low,Neutral
Contaminated water supply in Mujmahuda. VMC please help.,water,Akota,Mujmahuda,Social Media,High,Negative
Report: Water is not draining in Khanderao Market. Please resolve asap.,flooding,Nyay Mandir,Khanderao Market,Social Media,High,Negative
Complaint: Akota Bridge bridge is blocked due to heavy traffic. Calling municipal corporation.,traffic,Akota,Akota Bridge,Social Media,Medium,Negative
No water supply in Raopura since morning. VMC please help.,water,Raopura,Raopura,Social Media,High,Negative
Complaint: Heavy traffic congestion in Karelibaug during peak hours. It's been a week.,traffic,Karelibaug,Karelibaug,Social Media,Medium,Negative
Alert: Wrong side driving is rampant in Tandalja Road. Calling municipal corporation.,traffic,Vasna Road,Tandalja Road,WhatsApp,Medium,Negative
Report: Water logging issue at Sama Pond. VMC please help.,flooding,Sama,Sama Pond,Social Media,High,Negative
Please check: Narhari Hospital is completely submerged. #Vadodara #VMC,flooding,Fatehgunj,Narhari Hospital,Social Media,High,Negative
Traffic signal not working at Central Library crossroads.,traffic,Mandvi,Central Library,Social Media,Medium,Negative
Help needed: It's extremely hot in Sardar Estate today.,weather,Ajwa Road,Sardar Estate,Social Media,Low,Neutral
"Action required: Car collision at Khanderao Market, ambulance needed. Calling municipal corporation.",accident,Nyay Mandir,Khanderao Market,Social Media,High,Negative
Report: Bahut traffic hai Nyay Mandir par. It's been a week.,traffic,Nyay Mandir,Nyay Mandir,WhatsApp,Medium,Negative
Urgent: Garden maintenance needed in ONGC Main Gate. It's been a week.,other,Tarsali,ONGC Main Gate,Social Media,Low,Negative
Action required: Tree fallen on road in Tarsali. It's been a week.,other,Tarsali,Tarsali,Social Media,Medium,Negative
Traffic signal not working at Harni crossroads.,traffic,Harni,Harni,Social Media,Medium,Negative
Help needed: No water supply in Railway Station since morning. Authorities please take note.,water,Sayajigunj,Railway Station,WhatsApp,High,Negative
Alert: Yellow water coming from tap in Sayajipura. Authorities please take note.,water,Ajwa Road,Sayajipura,Social Media,Medium,Negative
Drainage overflow causing water to unexpected levels in Karelibaug.,flooding,Karelibaug,Karelibaug,Official App,High,Negative
Bohat garmi hai Karelibaug me aaj.,weather,Karelibaug,Karelibaug,News Headline,Low,Neutral
Help needed: Ganda paani aa raha hai ITI Gorwa me. It's been a week.,water,Gorwa,ITI Gorwa,Social Media,Medium,Negative
Action required: No electricity in Raopura for 4 hours. Calling municipal corporation.,electricity,Raopura,Raopura,Social Media,Medium,Negative
Help needed: Huge traffic jam at Gorwa. Calling municipal corporation.,traffic,Gorwa,Gorwa,Social Media,Medium,Negative
Drinking water smells bad in Vasna Road.,water,Vasna Road,Vasna Road,News Headline,Medium,Negative
Bohat garmi hai Sayajigunj me aaj.,weather,Sayajigunj,Sayajigunj,News Headline,Low,Neutral
Water is not draining in Leprosy Ground.,flooding,Ajwa Road,Leprosy Ground,Official App,High,Negative
Bahut traffic hai Manjalpur Naka par.,traffic,Manjalpur,Manjalpur Naka,News Headline,Medium,Negative
Please check: No electricity in Gorwa for 4 hours. Please resolve asap.,electricity,Gorwa,Gorwa,WhatsApp,Medium,Negative
Action required: Water pipeline leakage near Lehripura Gate. Very dangerous situation.,water,Mandvi,Lehripura Gate,Social Media,High,Negative
Cars parked illegally on Kala Ghoda road causing jam.,traffic,Kala Ghoda,Kala Ghoda,Official App,Medium,Negative
Alert: Very unhygienic conditions in Sayajigunj vegetable market. Please resolve asap.,garbage,Sayajigunj,Sayajigunj,Social Media,Medium,Negative
Report: Bike slipped due to oil spill near Ajwa Road. It's been a week.,accident,Ajwa Road,Ajwa Road,WhatsApp,High,Negative
Please check: Bike slipped due to oil spill near Akota. Calling municipal corporation.,accident,Akota,Akota,Social Media,High,Negative
"Report: Knee deep water in Kadak Bazar, please help. Very dangerous situation.",flooding,Sayajigunj,Kadak Bazar,WhatsApp,High,Negative
Pile of trash blocking the footpath in Leprosy Ground. Calling municipal corporation.,garbage,Ajwa Road,Leprosy Ground,WhatsApp,Medium,Negative
Alert: Cows sitting in the middle of Harni Warasia Ring Road road. It is very annoying.,other,Harni,Harni Warasia Ring Road,Social Media,Medium,Negative
Please check: Pile of trash blocking the footpath in Abhilasha Char Rasta. Calling municipal corporation.,garbage,Sama,Abhilasha Char Rasta,WhatsApp,Medium,Negative
Urgent: Cleaning not done in Khanderao Market society. It's been a week.,garbage,Nyay Mandir,Khanderao Market,WhatsApp,High,Negative
Report: Heavy rain predicted for Vasna Bhayli Road this evening. It is very annoying.,weather,Vasna Road,Vasna Bhayli Road,Social Media,Low,Neutral
Urgent: Heavy rain predicted for Jubilee Baug this evening.,weather,Raopura,Jubilee Baug,WhatsApp,Low,Neutral
Complaint: Sweepers not coming to Manjalpur Naka regularly. It's been a week.,garbage,Manjalpur,Manjalpur Naka,WhatsApp,Low,Negative
Report: Tree fallen on road in Vasna Bhayli Road. Please resolve asap.,other,Vasna Road,Vasna Bhayli Road,Social Media,Medium,Negative
Frequent power cuts in Saffron Tower since yesterday.,electricity,Fatehgunj,Saffron Tower,Official App,Medium,Negative
Accident ho gaya hai Ajwa Road me.,accident,Ajwa Road,Ajwa Road,News Headline,High,Negative
Report: Cleaning not done in Sayajipura society. VMC please help.,garbage,Ajwa Road,Sayajipura,WhatsApp,Medium,Negative
Urgent: Kachra pada hai Mandvi road pe. Calling municipal corporation.,garbage,Mandvi,Mandvi,Social Media,High,Negative
Urgent: Frequent power cuts in MS University Hostel since yesterday. VMC please help.,electricity,Fatehgunj,MS University Hostel,WhatsApp,High,Negative
Kachra pada hai Gorwa road pe.,garbage,Gorwa,Gorwa,News Headline,Medium,Negative
Yellow water coming from tap in Sayajigunj.,water,Sayajigunj,Sayajigunj,Official App,Medium,Negative
Alert: Pedestrian hit by a speeding car in Harinagar.,accident,Gotri,Harinagar,WhatsApp,High,Negative
Alert: Accident prone zone near Subhanpura Wadi school needs speed breaker.,accident,Subhanpura,Subhanpura Wadi,Social Media,High,Negative
Stray cattle blocking traffic at Manjalpur Naka.,other,Manjalpur,Manjalpur Naka,Official App,Medium,Negative
Accident prone zone near Vrindavan Char Rasta school needs speed breaker.,accident,Waghodia Road,Vrindavan Char Rasta,Official App,High,Negative
Complaint: Barish ka paani Sayajigunj me bhar gaya hai. Authorities please take note.,flooding,Sayajigunj,Sayajigunj,WhatsApp,High,Negative
Action required: Blinkering street lights at RC Dutt Road crossroad. VMC please help.,electricity,Alkapuri,RC Dutt Road,Social Media,Medium,Negative
Dustbins are overflowing at Sayajipura.,garbage,Ajwa Road,Sayajipura,Official App,High,Negative
Alert: Wrong side driving is rampant in Sama Pond. Calling municipal corporation.,traffic,Sama,Sama Pond,WhatsApp,Medium,Negative
No electricity in Akota Bridge for 4 hours. Very dangerous situation.,electricity,Akota,Akota Bridge,WhatsApp,High,Negative
Please check: Yellow water coming from tap in Fatehgunj. Authorities please take note.,water,Fatehgunj,Fatehgunj,WhatsApp,Medium,Negative
Urgent: Illegal encroachment on footpath in Alkapuri Club.,other,Alkapuri,Alkapuri Club,WhatsApp,High,Negative
Pile of trash blocking the footpath in Muktanand Three Roads.,garbage,Karelibaug,Muktanand Three Roads,News Headline,Medium,Negative
Help needed: Illegal encroachment on footpath in Harni Warasia Ring Road.,other,Harni,Harni Warasia Ring Road,WhatsApp,Medium,Negative
"Report: Knee deep water in Subhanpura Wadi, please help. VMC please help.",flooding,Subhanpura,Subhanpura Wadi,Social Media,High,Negative
